,ppt,country_native,country_nonnative,decision_making,P2_Q4,P2_Q5,Flag_Aim,Decision_Making,Additional_Comment
128,226,leeds,france,"i listened to the tips, the horses with better information about how they perform got a higher bet",to see if anyone struggled understanding the accents,,No,Speakers said,Accent comprehensibility
129,227,No,England,I didn't really have a strategy. Just based my bets on the information provided and what I could understand/,I'm not sure.,,No,Speakers said,N/A
130,228,Not sure,England?,How successful they said the horses had been recently,To see how people bet based on the voice they was listening to?,,No,Speakers said,Accent
131,229,Bolton,Turkey,Based on the recent race placements I heard within each of tipsters reportsthe ,To see whether the accent influences the perception of trustworthyness/reliability of information,,No,Speakers said,Trustworthiness + Accent
132,230,England,France,based on past performance and the speakers use of positive words,assess how we associate character with differing accents,,No,Speakers said,Accent
133,231,no,no,evenly,,,No,N/A,N/A
134,233,yorkshire/newcastle,spain,Based on what was said about them,to judge how people listen to native and nonnative speakers,,No,Speakers said,Accent
135,234,England,India,Evenly across it all,perceptions of different accents,,No,N/A,Accent
136,236,Midlands,No,I decided to distribute my bets on how the horses were described in terms of strength and liklihood of success in this type of race.,To determine whether people would put more trust in the native speaker or the non native speaker.,,No,Speakers said,Trustworthiness + Accent
137,238,Leeds,No,By how much I understood from what they were saying,,,No,Speakers said,N/A
138,239,"Midlands, England",Spain/ Portugal,Language they used ,whether accents implicated trust ,,No,Speakers said,Trustworthiness + Accent
139,241,Northern England,France,Based on how positive the speaker appeared to be when talking about the horse,How different accents can influence your judgement of a person,,No,Speakers said,Accent
140,243,Northern England,Spain/Italy,Overall relativley equally distributed but slightly higher/lower depending on descriptions of speaker's,Trustworthiness depending on the speaker being native or non-native,,No,Speakers said,Trustworthiness + Accent
141,247,yorkshire,spain,the descriptions of the horses,to see opinions and trust on non-native english vs accented english ,,No,Speakers said,Trustworthiness + Accent
142,249,Scotland,Poland,What was said about each horse by the speaker,Whether we listen more to a native speaker over a non-native speaker,,No,Speakers said,Accent comprehensibility
143,251,Ireland,India,Based on horse names,Unsure,,No,Names,N/A
144,252,"Somewhere in the UK, possibly North England?",Spain or Eastern Europe?,"I struggled to understand the accent and picked up more words from the native English speaker, they also sounded slightly more enthusiastic",To study whether a foreign accent has a negative effect on decisions?,,No,Speakers said,Accent
145,253,England,Spain,By how positive the speakers sounded,to test how different accents affect perception,,No,Speakers said,Accent
146,254,England,France,Mainly based on the positive words used for each horse,Unsure,,No,Speakers said,N/A
147,256,Scotland,Portugal,The information given about the horses positions in previous races,To determine if people are biased towards the information given by non-native speakers.,,No,Speakers said,Accent
148,258,Yorkshire,Spain,I based them on which speaker was more professional.,To see how accents affect individual decisions.,,No,Speakers said,Accent
149,259,England,Belgium,"By what each expert said, and how confident they sounded. For example, saying \I think...\ doesn't sound fully confident, especially from a horse-racing expert.","To examine people's judgement of information when given in different accents, native or non-native.",,No,Speakers said,Accent
150,260,"Yorkshire, England",France,By how promising the horse sounded,"To gauge how people perceive how trustworthy an individual is, based on how well they can understand what they are saying",,No,Speakers said,Trustworthiness + Accent
151,261,england,india,on what they said about the horse itself,see if non native views change peoples views?,,No,Speakers said,Accent
152,262,scotland,italy,how well i thought the horse would do,not sure,,No,Speakers said,N/A
153,263,yorkshire,no,evenly to increase chances,to assess accent and influence in trust around gambling decisions,,No,N/A,Trustworthiness + Accent
154,265,England,No,Based on the confidence of trust in the horse,,,No,Confidence,N/A
155,266,England,Poland,Wait until they all had finished speaking then bet,attitudes towards different speaking people,,No,Speakers said,Accent
156,267,Yorkshire,Germany,What had been said about the different horses,to see whether a non-native english speaker impacts on how people make bets,,No,Speakers said,Accent
157,268,north england,spain,"40,20,20,20",no idea,no,No,N/A,N/A
158,269,London,Italy,From horses experience told by the speakers,About accents of non natives and natives when listening to information,n/a,No,Speakers said,Accent
159,271,Spain,Scotland,Trainers comments,trustworthiness ,,No,Speakers said,Trustworthiness
160,272,Scotland,Spain,I just went with my gut feeling,Unsure,,No,N/A,N/A
161,273,no,no,based on what they said bout the horse and their confidence ,not sure,,No,Speakers said,N/A
162,274,Yorkshire,Sweden,How confident the speaker sounded in their horse,To see whether a familiar accent would cause a listener to trust someone more.,,No,Confidence,Trustworthiness + Accent
163,275,manchester,not sure,evenly,not sure,,No,N/A,N/A
164,278,Scotland ,Norway ,the ones i was attracted to got a higher price on them ,i think its to do with native and non native language and descriptions and how that would influence ones decision ,great survey ,No,Attraction,Accent
165,279,Midlands,Spain,"More on the less chopped up sounds, native or non-native, less on the one that i coudl ehar the sound had been chopped to remove ums/buts",If non-native accents affects our biases,,Yes,Delivery,Accent
166,280,Not sure,Somewhere in Poland,Almost completely randomly.,,,No,N/A,N/A
167,282,England,Spain,Based on how positive the recording was,To see if people are biased towards the native speaker and bet more on the horses they describe,,No,Speakers said,Accent
168,284,north england,japan,based on the information I was provided,how non-native and native speakers impact decisions,,No,Speakers said,Accent
169,285,yorkshire,poland,flanks,pregerditial attitude to non native speakers,,No,Speakers said,Accent
170,286,Manchester,Poland,What positives I understood most,Understand the influence of languages and accents,,No,Speakers said,Accent
171,290,England,Spanish,"On fluency, one of them kept being broken up saying emmm, didnt sound like she was confident with what she was talking about",How we interpret different accents,,No,Delivery,Accent
172,293,Oxford,France,By the descriptions of the horses,to see how people perceive native and non-native English speakers ,,No,Speakers said,Accent
173,294,"South of England, UK",Brazil,By how many positive things I heard about the horses,if accents affect outcome  ,,No,Speakers said,Accent
174,296,France,England - not sure where exactly,Based on what the speakers said,See if you prefer and trust native or non-native speakers more,,No,Speakers said,Trustworthiness + Accent
175,299,No. Sorry,No. Sorry,Purely guesswork.,If I made better decisions when listening to the native speaker?,,No,N/A,Accent
176,302,England,Spain,"I chose the horse that sounded successful, and which they were describing as not so successful or I couldn't get enough information from ",To see if I would bet less with less understanding of what was said,,No,Speakers said,Comprehension
177,303,England ,Spain,I tried to distribute equally but increased the amount slightly if the speaker gave confident sounding stats.,,,No,Speakers said,N/A
178,304,UK,no,The description,unsure,,No,Speakers said,N/A
179,306,England,France,I went off the advice given ,To see if where someone is from impacts if you listen to them ,,No,Speakers said,Accent
180,307,Southampton,Germany,Based on information given by speaker,See whether we put more money on a clearer speaker as opposed to actual facts about the horse,,No,Speakers said,Delivery
181,308,Yorkshire,India,based on what they said and how confident it sounded ,to see how different accent will make a difference to how we bet,,No,Speakers said,Accent
182,309,russia ,england ,with the information provided weighing pros and cons ,to listen to the descriptions and base a bet onto who i think would have highest earnings  ,,No,Speakers said,Betting behaviour
183,310,I don't know,I don't know,I went based off the feedback given on the horses,,,No,Speakers said,N/A
184,311,North England,Spain,I tried to follow what they were saying about horses though I struggled as I didn't understand a lot of the context,See if we are more likely to bet on the native speaker's horses as we view them as more competent and trustworthy as well as educated,N/A,No,Speakers said,Trustworthiness + Accent
185,313,Bradford,India,Whether the language sounded confident,how accents influence decision making,,No,Confidence,Accent
186,314,UK,Brazil,"based on the information given, rather than by the accent or speaker",to see if accent affected interest and influences bets?,it was an interesting study,No,Speakers said,Accent
187,315,spain,united kingdom,on how well the horses have done in the previous races,to place your bets on each of the horses the native and non native speaker describes them ,great survey,No,Speakers said,Accent
188,316,England,Poland,Based on the information given to me,To see how people's level of understanding/feelings toward non-native and native speakers effects how they would distribute money,,No,Speakers said,Accent
189,318,somewhere down south,A european country,Based on what the speakers said,Not quite sure,,No,Speakers said,N/A
190,319,England,France,On who they said performed best recently.,No idea.,,No,Speakers said,N/A
191,320,UK,Italy,Which horse had been on good form,,,No,Speakers said,N/A
192,323,Wales,Poland,I listened to the description given for each horse and decided based on how the description made them sound,To see if native speaker can influence peoples decisions more,,No,Speakers said,Accent
193,326,Bradford,French,Horse number 3 had more memorable positive words. Found it hard to understand the non-native especially with the first horse,How easy it is to make a decision based on the positive words you hear,Before the recording started the top images covered the last bit of instructions.,No,Attraction,Accent
194,328,England,No idea,Evenly but more towards the better sounding horses,To see if we are more inclined towards english sounding people.,,No,Speakers said,Accent
195,329,Spain,Manchester,The horse described in the most positive way was where I put most of the money,To see if people trust the native accent more. ,,No,Speakers said,N/A
196,331,Yorkshire?,Israel?,To be honest I was quite influenced by the pictures and names of the horses!,TO look at subconscious biases based on accents and linguistic ability.,"The native speaker was slow, did not sound like they knew what they were talking about. lots of ums.",No,Names,Accent
197,333,England,Belgium,"30, 30, 15, 25 going off key words used.",Potentially something about using advice from a native and a non-native speaker,N/A,No,Speakers said,Accent
198,334,No,England,I listened carefully to the descriptions and tried to gauge which action would be best.,To see how people respond to fluent and non-fluent speakers when making a judgement. ,,Yes,Speakers said,Delivery
199,335,No,No,Most confident statment,preferance on race,na,No,Speakers said,Accent
200,336,Southern England,France,I did equal bets for each horse,If we are biased towards non native speakers,,No,N/A,Accent
201,338,Manchester,Spain,"Based on the strength of the horse, i.e. less money for one that seems more likely to be runner-up",To see if we find non-native accents less trustworthy or reliable,,No,Speakers said,Trustworthiness + Accent
202,340,UK,Spain,I went with the information given and the confidence that I felt from the facts given to me,To see if non-native speakers and native speakers have a different level of trustworthiness  ,n/a,No,Speakers said,Trustworthiness + Accent
203,341,northern England,italy,"I put a lower amount on each, based on the fluency of the speaker talking and tried to put an even amount on each but little enough that I wouldn't be upset if I lost ",to see if people favour native or non native speakers,,No,Delivery,Accent
204,342,Poland,Manchester,I distributed them equally as it was the easiest to do.,The aim was to see if there was much of a difference between the native and non native English speaker.,,No,N/A,Accent
205,343,"Not sure, honest!",England,"Listened to what they said and thought about whether it seemed likely or not it would win, really.",,,No,Speakers said,N/A
206,348,UK,eastern europe,"Where the strongest recommendations were, with smaller placed on those more in question",Confidence in the ability of non-native speakers?,,No,Speakers said,Accent
207,349,England,Portugal,Just on how well the speaker advocated for the horse,Whether where a speaker is from has any impact on how trustworthy they are,N/A,No,Speakers said,Trustworthiness + Accent
208,352,Manchester,France,guess based on the speakers,to do with speakers,,No,Speakers said,N/A
209,353,England,Poland,On the descriptions given,How much to trust someone based on their accent,,No,Speakers said,Trustworthiness + Accent
210,354,England,Asia,I distributed them equally,To judge how we felt about a non-native speaker,none.,No,N/A,Accent
211,355,North england,India,From how well the horses were explained by the speaker and how good they made them sound,To see how we perceive different accents and how much we trust what they say.,,No,Speakers said,Trustworthiness + Accent
212,356,UK,Spain,Based on their view of the horse and its previous successes,See4 if we find non-native speakers less informative or trustworthy,"The English accent was frustrating and untrustworthy due to the erm uhm errr all the way through it, made it really difficult to focus on what she was saying.",No,Speakers said,Trustworthiness + Accent
213,358,Scotland,Scandinavian country ,information given from the speaker,to see if the speakers accent/nationality influences their perceived credibility,,No,Speakers said,Trustworthiness + Accent
214,359,Liverpool,Romania,by the positive things each person said; and how many positive things which were mentioned,To see how accents influence our decision making,,No,Speakers said,Accent
215,363,England,Romania,Mostly the content of the words as opposed to how they were delivered,To understand how trustworthy people find non-native and native accents,,No,Speakers said,Trustworthiness + Accent
216,366,UK,Spain,Based on how strong the horses were and how well they've done recently,To see if your opinion changes based on who you're hearing the information from (native or non-native speaker),,No,Speakers said,Accent
217,367,England,Norway,Based on the previous performances of the horses,to see the effect of accents on decision making,,No,Speakers said,Accent
218,368,England,I'm not sure,I tried to go off the information given to me based on their past performance.,To test whether horses with a native speaker description would get higher bets,,No,Speakers said,Accent
219,369,south America ,not sure,listening to the descriptions ,to see if the instructions ,You have NaN pounds left.   - there was an error. ,No,Speakers said,N/A
220,370,Wales,Spain,A guess on an idea of their likelihood to win the race,To see if the accents of the experts impacted on my estimation of if the horse would win,,No,Speakers said,Accent
221,371,united kingdom,eastern europe,25% chance for each of them,to assess our opinions on language,,No,N/A,Opinions
222,378,uk,no,evenly,perceptions of accents,,No,N/A,Accent
223,379,england,india,which horses seemed most promising ,comparing accents,,No,N/A,Accent
224,380,United Kingdom,Eastern Europe,By how the speaker described the horses,To see how people trust people of different backgrounds when putting money on a bet,,No,Speakers said,Trustworthiness + Accent
225,385,England,n/a,the amount of hesitations in speech ,,,No,Delivery,N/A
226,389,No idea!,France,"Based on the information about the horses past performances and experience. Also, how confident I perceived the speaker to be. For the first and last audio recording, the speakers said 'uh' and were less fluent in their answers, which left me feeling less certain of the information provided. ",To explore whether people trust the opinion of people with similarities to them (i.e. accent) - that they feel more alike with,,No,Delivery,Trustworthiness + Accent
227,393,Birmingham,Poland,By past performance as described,To understand how different accents/native or non native impacts how we trust voices,,No,Speakers said,Trustworthiness + Accent
228,394,manchester,france,Listened to their advice,To see which opinion we value more,,No,Speakers said,Accent
229,395,London,India,Guesswork,Trust in native speakers vs non native speakers,,No,N/A,Accent
230,396,Spain,Yorkshire,Based on the voice and the confidence they spoke at,To view opinions on native vs non-native speakers and how it influences our decisions ,,No,Confidence,Accent
231,398,Northern England,South Asia,I decided to split them between the horses that sounded the best.,To see if people bet less on the non-native speaker.,,No,N/A,Accent
232,400,England,Spain,Gut feeling and judgement of description,effect of accents when money is at stake,,No,Speakers said,Accent
233,402,Scotland,Italy,Based on the information provided and how enthusiastic the language was about the horses.,"To study variables in native and non-native accents, language and tone.",,No,Speakers said,Accent
234,404,England,Spain,"I listened to the feedback and judged it based on what the speakers said. For example, if they reported there was confidence in the horse from officials then I felt it was a safe bet.",To determine how you take in information dependant on the speaker and accent.,,No,Speakers said,Accent
235,405,Midlands,Eastern Europe,Based on the likelihood of the horse winning,To see if accent  of speaker affected horse betting.,,No,Speakers said,Accent
236,406,no,no,from the tips,not sure,,No,Speakers said,N/A
237,408,England,Spain,fairly even but tried to pick a favourite,betting on horses,,No,N/A,Betting behaviour
238,409,England,France,I found it easier to understand the native speaker and they appeared more confident in the information given.,To assess the perceived trustworthiness/knowledge of a native speaker to a non-native speaker.,,No,Confidence,Trustworthiness + Accent
239,411,France,Scotland,Based on how confident the speakers tone was and the context of their speech,"Unsure, gambling related but somehow something to do with language? Maybe the impact of accent on tipsters?","Nice survey, good luck with your conclusions",No,Confidence,Accent
240,413,Scotland,Poland,On the advice,Perception of non-native speakers,n/a,No,Speakers said,Accent
241,415,England,Italy,at Random,To see how somebody's accent affects credibility,,No,N/A,Accent
242,416,France,England,Depending on how the horses had done in previous races.,How people percieve non-native speakers.,,No,Speakers said,Accent
243,420,United Kingdom,Spain,The ones that were described with most confidence got the most money.,,,No,Speakers said,N/A
244,422,Somewhere in North Yorkshire,France,Distributed equally leaving myself some money as I didnt think the descriptions gave me much to go on. ,How much we trust native speakers over non natives. ,,No,N/A,Trustworthiness + Accent
245,424,Yorkshire,France,Based on information provided about the horses,Opinions on native/non-native spoken English,,No,Speakers said,Accent
246,425,Birmingham,Sweden,I put more money on horses that the speakers told me 'were a runner up in a previous race' for example. Not just 'he's doing well'...,"To see who we trust more, native speakers or non-native speakers",,No,Speakers said,Trustworthiness + Accent
247,428,liverpool,spain,Based on how knowledgeable the speaker sounded and their interest in what they were saying,How racial bias affects betting? ,,No,Speakers said,Accent
248,429,no ,spain,based on the confidence of the words spoken ,not sure ,,No,Confidence,N/A
249,432,north?,spain?,based on what they said but also a bit randomly,,it screened me out even though i met the criteria but i think that was a glitch because then it continued and i completed the whole survey,No,Speakers said,N/A
250,434,Hull,Italy,Based on the enthusiasm about the horses shown by the speakers.,To see whether accent makes a difference in taking advice.,N/A,No,Confidence,Accent
251,435,france,america,evenly,not a clue,,No,N/A,N/A
252,436,England,Italy,Based on what they said about the horses,,,No,Speakers said,N/A
253,438,Britain,China,The information about the horses and how well they'd done previously,Whether people judge non-native speakers differently to native speakers,,No,Speakers said,Accent
254,439,manchester,spain,based on the information provided ,how information is provided effecting decisions made,,No,Speakers said,Betting behaviour
255,440,No,No,Equally but low to avoid big losses and because none of the horses were spoken about enthusiastically,Not sure,,No,N/A,N/A
256,444,Yorkshire,France,Based on the information as to how the horses have been performing,How well accents can be understood,,No,Speakers said,Accent
257,445,UK,Poland,split amongst the 4 horses,to understand people's perception of native and non-native speakers,,No,N/A,Accent
258,446,england,asia,25 on each split evenly,to see the difference in trust of two accents,,No,N/A,Trustworthiness + Accent
259,447,yorkshire,poland,"the statistics on the horses, putting more money on the horses i felt would be more likely to win",to see if people bet more on the horse that is being spoken about by the native speaker,,No,Speakers said,Accent
260,451,Newcastle,India,I listened to the information they were talking about.,Language and persuasiveness?,,No,Speakers said,Persuasiveness
261,452,England,Spain,From performance and ability,distinguish between accents,,No,Speakers said,Accent
262,454,Birmingham,Portugal,All on the first horse,Possibly seeing how the speaker / tone / accent could affect decision making.,"Great survey, would love to participate in similar again.",No,N/A,Accent
263,456,england,spain,how good they made the horses sound,relativity between accents and competency ,,No,Speakers said,Accent
264,458,Coventry,The Netherlands,Based on how convinced I was by the speaker,To see how people respond to different fluency and language,,No,Confidence,Delivery and accent
265,459,n/a,n/a,i weighed it up evenly,to test processing info from different dialects,,No,N/A,Accent
266,460,UK,Spain,I just did it equally,How much I would bet depending on whether the speaker was native or not,,No,N/A,Accent
267,462,England,Spain,Horse descriptions,Confidence in information provided by non-native speakers,,No,Speakers said,Accent
268,463,England,Sweden,Apocalypse was the first I saw,To see if a narration would have an effect on betting,,No,N/A,Betting behaviour
269,465,England,Unsure,"I didn't think it really mattered how I distributed the bets as the money was not real, I put higher bets on the horses that I felt were described well",To see how the speaker impacts how people make decisions,,No,Speakers said,Accent
270,466,England?,No idea,"I was expecting to hear about perhaps how many races they'd run things like that, I didn't feel that there was a lot of useful informaiton about the horses, so i ended up doing it evenly. Although the non-native seemed to be more enthusiatic about the first two horses. ",Ability to be influenced by native and non-native accents. ,"Nothing to add, good luck!",No,N/A,Accent
271,469,London,India,I put lower money on the horses that didn't sound like they had much chance of winning and the highest on the horse who seemed the favourite.,,,No,Speakers said,N/A
272,471,North of England,Spain,Based on trusting the person and what they said about how good the horse was ,Asses our bias around accents ,,No,Trust,Accent
273,475,London,Poland,I trusted the horses more if they had been racing for longer,To look for prejudice and discrimination based on accent,,No,Speakers said,Accent
274,476,no,no,most confident about speaking abou the horses,not sure,,No,Confidence,N/A
275,478,America ,unsure,listening for any positive comments  ,placing bets on information given to you,,No,Speakers said,Betting behaviour
276,479,Ireland,Western-Asia,On how enthusiastic the speakers were and the comments made about each horse.,Perceptions based on accent and voice.,,No,Confidence,Accent
277,483,Scotland,India,based on the wording they used and also bearing in mind that I hadn't heard about the other horses yet,To see if betting behaviour changes in native vs non native speaking,,No,Speakers said,Accent
278,484,England,Mexico,After listening to them all together i decided to change my bets to what i thought sounded more trustworthy,To see which speaker was more understandable ,great enjoyable survey ,No,Speakers said,Accent
279,485,Manchester,France,By the past of the horse and it's winnings,To see whether people think differently about non-native speakers and trust them less,,No,Speakers said,Accent
