,ppt,country_native,country_nonnative,decision_making,P2_Q4,P2_Q5,Flag_Aim,Decision_Making,Additional_Comment
280,488,Somewhere North,Israel,I tried to determine how confident they sounded in the recordings and listened to the positivity of their vocabulary,To determine whether people make judgments based on the fluency of language and whether accents affect this,,No,Confidence,Delivery and accent
281,489,UK,France,"based on form, detail of previous",view biases based on our perception of language - did more choose the native speaker etc,,No,Speakers said,Accent
282,490,Yorkshire,France,Based upon the information I could hear and understand completely.,To see how behaviour changes when listening to both native and non-native speakers,,No,Speakers said,Accent
283,491,uk,spain,"listening to the information, also how smooth it was",how an accent can affect things such as decisions,,No,Speakers said,Accent
284,497,manchester,colombia,based on the info given,see the difference in trustworthness of uk vs non uk natives,,No,Speakers said,Trustworthiness + Accent
285,498,Spain,"Yorkshire, England",Based on statistics and form,To determine whether peoples betting behaviour differs depending on the speaker,,No,Speakers said,Accent
286,500,UK,Spain,Based it on what was said about the horses,To see if the accent affected our choice of bet,,No,Speakers said,Accent
287,501,Yorkshire,France,Whether I heard positive reassuring things,,,No,N/A,N/A
288,503,England,spain,I only put a little amount on the first 3 horses as i was not confident in them so then i had a lot of money to place on the 4th horse still,too see if the sound of a person changes your opinion on their knowledge.,n/a,No,N/A,Accent
289,504,scotland,spain,i listened to the content ,to detect bias,,No,Speakers said,Accent
290,505,Somewhere north of the country?,Possibly the middle east?,I decided based on the confidence of the speakers. Both the native and non native speaker seemed much more confident in the way they spoke about the horses I placed the highest bets on (no ums and ahs) - however there were more 'cuts' in the audio in these so they might not have been confident and just cut the pauses out. ,To find out if people prefer information from native or non native speakers? ,,Yes,Speakers said,Accent
291,506,Ireland,France,"Partly on the descriptions if I could understand what was being said, but if I couldn't unerstand then just randomly.",Opinions of native versus non-native speakers,,No,Speakers said,Accent
292,507,Scotland/Nothern,Norway/Germany,Based on my level of interest,To determine whether we choose something based on how someone describes it/their tone,,No,N/A,Delivery
293,508,North England,Spain,how well it seems the horse was doing,,,No,N/A,N/A
294,509,UK,Spain,Split the money evenly ,To see peoples betting behaviour ,,No,N/A,Betting behaviour
295,510,Couldn't guess ,Couldn't guess,Based on what was said by the speakers,If there is a difference in non-native and native and trust worthiness ,,No,Speakers said,Accent
296,512,no,no,listened to what they had to say,to see if people bet more with the native speaker,,No,Speakers said,Accent
297,513,UK,Netherlands,How persuading the descriptions were ,peoples views on native compared to non-native speakers,,No,Persuasion,Accent
298,514,Scotland,Spain ,I listened to what they said about their performance previously ,To see if we trust native or non-native speakers more,,No,Speakers said,Accent
299,515,northern but unsure where ,European (maybe greek),tried to listen to specific mention of where gorses had placed in the past ,to see if people find native speakers more trustworthy than non native speakers despite being told they have the same level of expertise ,,No,Speakers said,Trustworthiness + Accent
300,516,Yorkshire,Czechia ,How enthusiastically the experts spoke about the horses,Whether people are more likely to take advice from native speakers.,,No,Confidence,Accent
301,517,Spain,Northern England,By which speaker sounded most interested in their horse,To see the influence of accents,,No,Confidence,Accent
302,519,Newcastle,Italy,Based upon how good the horses sounded based on the descriptions and the enthusiasm with which they were described,See the impact of accents on trust,,No,Confidence,Trustworthiness + Accent
303,521,Poland,England,Based on their information shared ,Different speaker to if people bet more,,No,Speakers said,Accent
304,523,Leeds,Asian,Based upon what the speaker said,To see peoples opinions on native and non native english language,na,No,Speakers said,Accent
305,524,manchester,spain,randomly,whether people bet more on native speakers or non native,,No,Speakers said,Accent
306,525,South,Slovakia,Based on what they said about the horses,To determine whether accents influence decisions more?,,No,Speakers said,Accent
307,526,spain,manchester,"to what i thought was the better horse, stronger horses",to see peoples behaviours towards accents/betting,,No,Speakers said,Accent
308,528,England,France,"I listened closely to what the speakers said about the horses and what i could understand, and also how confident they sounded",To see if people are biased towards people with different accents,,No,Speakers said,Accent
309,529,UK,India,"I tried to base it on the content of the recordings, particularly on whether each horse had a previous record of success","Determine how someone's accent affects perceptions of their competence, trustworthiness, etc.",n/a,No,Speakers said,Trustworthiness + Accent
310,531,Scotland,Spain,Based on the information provided. If I wasn't sure I went with a lower bet,I don't know,,No,Speakers said,N/A
311,532,Leeds,China,based on the facts shared by the speakers,to see if an accent can influence individuals trust and subsequently betting behaviours,,No,Speakers said,Trustworthiness + Accent
312,534,England,France,Evenly across 3 ,Trust in different accents ,,No,N/A,Trustworthiness + Accent
313,537,england,india,by how confident they spoke about the horse ,unsure,,No,Confidence,N/A
314,539,unsure,unsure,"Just went off the most information given, that sounds more promising.",unsure.,,No,Speakers said,N/A
315,540,sheffield,france,I listened to how they described the horses success but I dont know much about horse racing so it was largely a guess,To gauge peoples opinions of native vs non native speakers,,No,Speakers said,Accent
316,541,Manchester,Spain,Based on the information given,See how different accents affect our decision making,no,No,Speakers said,Accent
317,543,Scotland,Italy,tried to listen to the facts,to see if there is a negative bias towards non-native speakers,,No,Speakers said,Accent
318,544,London,Sri Lanka,I listened out for previous successes ,to see if people prefer native or non native speakers.,,No,Speakers said,Accent
319,545,Northern England,India,Based on the descriptions and details provided. The one that gave more details and spoke to longer lengths about the horse garnered my attention more.,Whether a non-native speaker of English is a detriment to them providing information/tips on a subject.,,No,Speakers said,Accent
320,546,no,France ,based mostly on the look of them,to see what influences decisions ,it was hard to understand the non native speaker but it was more interesting to listen to.,No,Speakers said,Betting behaviour
321,547,Don't know,France,Based on the quality of information given,The influence of accents on people's trustworthiness?,,No,Speakers said,Trustworthiness + Accent
322,548,Scotland,Spain,Language used to describe the horses,How we perceive information differently between native and non native speakers,N/A,No,Speakers said,Accent
323,549,Scotland,Eastern Europe,I usually bet equally ,To see how the accent may influence the way I bet,N/A,No,N/A,Accent
324,551,Manchester United Kingdom,India,Tried to listen to the tips and take faith in the voices.,Understand perception of native and non native voices,,No,N/A,Accent
325,553,England,France,I didn't understand much of the differences between the horses so I trusted the speakers judgement ,To examine bias of native/ non-native speakers ,,No,Speakers said,Accent
326,554,Midlands,Spain,Mainly guesses,how people perceive non-natives,,No,N/A,Accent
327,555,"Newcastle, UK",Spain,The names of the horses,The difference between receiving information from native and non native persons,,No,Names,Accent
328,563,Northern England,Unsure,Different comments from the commentators,see bias or judgement for different accents,,No,Speakers said,Accent
329,567,No,No,I struggled I only put down £20 I wasn't really convinced by either speaker the native speaker sounded uninterested,To see how people react to native speakers compared to non native speakers,No,No,N/A,Accent
330,570,Yorkshire,China,Purely a guess on if the next one would be better or worse,Opinions on native v non native speakers ,,No,N/A,Accent
331,572,UK,Eastern Europe,put more on tips from non-native speaker,Determine influence of native speaker vs non-native speaker,,No,N/A,Accent
332,573,UK,"Somewhere in Europe, maybe Spain though I'd need to listen again- couldn't really understand much she was saying thp",Honestly it was a little random as I couldn't understand the non-native speaker very well,To see if we bet more when the speaker is native,Couldn#t understand non native woman so didn't know what to bet,No,N/A,Accent
333,575,Northern England,France,Based on previous wins and the opinion of the horses,To see if people find a native of their country more trustworthy,,No,Speakers said,Accent
334,576,UK,France,Based on clarity of the speaker,Unsure,,No,Speakers said,Accent
335,577,Scotland,South-asia,I thought the information contained in some of them seemed more objective (based on results etc) and was more in depth.,n/a,n/a,No,Speakers said,N/A
336,579,Birmingham,Pakistan,BAsed on what was said and how they sounded,To listen to voices,,No,Speakers said,N/A
337,583,UK,France,Based on how they describe the horses,To see how trustworthy etc people find native/non-native voices,,No,Speakers said,Trustworthiness + Accent
338,584,england,spain,past performance and consistency,,,No,Speakers said,N/A
339,585,scotland,spain,cautiously but going off what they had said - certain horses appeared to be likely to do better,evaluate prejudice when it comes to people/their accents,,No,Speakers said,Accent
340,586,South West,INdia,I don't understand horse racing terms so went with what sounded better,Judgement based on understanding accents,Both audios were difficult to hear based on the cuts in audio,Yes,Speakers said,Accent
341,587,Norwich,France,Based on the description of the horses,To determine the emotions of listening to different accents,,No,Speakers said,Accent
342,591,Scotland,Italy,"I tried to base my bets off the information the two speakers gave me about the horses.  However, I will admit that I struggled to understand the non-native speaker's accent at times and that also affected how I placed the bets.",To see how people react to native vs non-native speakers and whether or not an accent can have an effect on how we view someone's information/opinion/expertise.,,No,Speakers said,Accent
343,593,England,India,Even distribution between the two most confident sounding descriptions,To study racial biases,,No,N/A,Accent
344,597,yorkshire,france,I used all the money on the one horse I thought sounded the most promising,"to see if I, an native speaker, was more likely to trust someone who speaks the same language",,No,N/A,Trustworthiness + Accent
345,600,Northern England,not sure,How well I could understand the speaker,To see if there is a positive bias towards people who speak the same as you,,No,N/A,Accent
346,601,england,no,based on the comments made,to decide if people trust native speakers more as they are familiar.,i based my decision on the facts rather than who was saying them,No,Speakers said,Accent
347,610,Manchester,Not sure,"Mostly even, but there were a few that stood out slightly more",How trustworthy we thought the native/non-native speaker using our betting behaviour as a measure of bias?,,No,Speakers said,Trustworthiness + Accent
348,611,England,Brazil,Based on relation to other races,If we downplay the bet based on accents,,No,Speakers said,Accent
349,612,Spain,England,Based upon the information provided by the speakers,To gauge people's responses to a native speaker in comparison to a non-native speaker and the impact this has on their ability to learn from them ,,No,Speakers said,Accent
350,613,England,Asia,"I bet more on horses that received a lot of praise, but I bet a little on every horse.","To see how someone's accent can affect how they are perceived, if native speakers are seen as more intelligent than non-native speakers. ",,No,Speakers said,Accent
351,614,Scotland,Spain,How they ran in previous races,to see if betting on horses are swayed when being told information by native or non-native speakers,,No,Speakers said,Accent
352,615,England,Spain,Based on their discussion,Understand peoples experience of native speakers,,No,Speakers said,Accent
353,617,England,Spain,Mostly even with a differences coming from recent 'results' and the speaker's confidence.,To understand how fluency of speech influences the listener's trust.,,Yes,Speakers said,Delivery and trust
354,621,Midlands/North of England,Subcontinental Asia,"Based on the perceived confidence of the tipsters, but also the names","How people are more or less likely to trust native versus non-native experts, with different levels of fluidity in their speech",,No,Speakers said,Delivery and trust
355,622,England,India,Based on how confident they seemed that the horse would perform well.,,,No,Speakers said,N/A
356,623,England,Spain,Whichever sounded most positive,Reaction to native & non-native speakers,,No,Speakers said,Accent
357,624,the north,italy,I could understand the native speaker better so I put slightly more money on their horses,to understand bias of accents,,No,Speakers said,Accent
358,625,Yorkshire,Belgium,Based on what I could understand from the speakers and what I heard based on the horse's previous racing experience and triumphs.,"To determine whether the ability to understand an educator influences people's choices, in this case on horse racing.",,No,Speakers said,Accent
359,626,Birmingham,Polish,I listened to what the speakers said and followed my gut,To see how much people would bet on horses when they are being told about them by people with different accents. ,,No,Speakers said,Accent
360,627,United Kingdom,Sweden,The positive and enthusiastic words used for certain horses helped me bet more on those. ,,,No,Speakers said,N/A
352,629,Scotland,Italy,"I initially aimed to distribute the money evenly amongst the horses, but upon hearing the voices and descriptions I changed my tactic to increase the amount on horses being described more confidently and spoken about with more authority.  ",Something relating to how confident a person sounds having an influence over decision making,,No,Speakers said,Confidence
353,630,england ,spain,based on past performance ,,,No,Speakers said,N/A
354,631,England,France?,I tried my best to form opinions on all of the horses compared to each other with the information given. I didn't spend all the money but I put the most on the horse I thought had the best chance given the information,To assess peoples reactions to native speakers vs non-native speakers,,No,Speakers said,Accent
355,632,England ,no,"10 on each of the horses on the left, 40 on each of the horses on the right ",,,No,N/A,N/A
356,633,Kent,Spain,Key words used and confidence of speech,If accents affect behaviour,,No,N/A,Accent
