,ppt,country_native,country_nonnative,decision_making,P2_Q4,P2_Q5,Flag_Aim,Decision_Making,Additional_Comment
1,1,London,Italy,Based on what the speakers said,To see whether you place more money in a bet on the native speaker vs the foreign speaker,,No,Speakers said,N/A
2,3,Scotland,Spain,"Wording, tone and delivery of the speakers",Explore interpretations of native vs non-native speakers,,No,Delivery,N/A
3,4,"North of England - Nottinghamshire, or Yorkshire (South Yorkshire?)","I thought one sounded Spanish, the other French","It was difficult to gauge the likely success of the horses because none of them were described as dominant and dead certs, so I adjusted my previous bets accordingly when I learned about the next horse",To gauge trustworthiness and emotional responses and connections when comparing information given by native/non-native speakers,"I didn't find in hard to place trust in the non-native speakers, or rather I didn't trust them less, but the information was quite recondite and very specialised, so while I appreciated their obvious intelligence and fluency in communicating abstract information in a non-native language, the accent did sometimes make it hard to fully understand what was being said and this is a problem with something I am ignorant of and that is quite info-dense",No,Uncertainty,Trustworthiness + Accent
4,5,England,Germany,From how the speakers described the horses,Understanding and Trustworthy of Native/Non-Native speakers?,,No,Speakers said,Trustworthiness + Accent
5,6,Scotland,Poland,The names of the horses,To see if non-native speakers have the same level of trust as native speakers,,No,Names,Trustworthiness + Accent
6,8,the UK,maybe Asia?,The native speaker paused a lot and delivered the info very poorly,,,No,N/A,N/A
7,9,England ,Eastern European,How well I could understand the description and how good the horse sounded ,"To see whether we make judgements based on non-native speakers e.g., less likely to trust them/judge them as competent ",Some of the tech was not the best on my MacBook ,No,Speakers said,Trustworthiness + Accent
8,12,Italy,Scotland,based upon the information that I could understand (which was very little),to understand trustworthiness based upon accent and clarity of speech,,Yes,Speakers said,Trustworthiness + Accent
9,13,spain,england,mostly equally but changed depending on the description,to see opinions based on native and non native speakers,,No,Speakers said,N/A
10,15,Lancashire,Hungary,I merely split the bets evenly between the four horses. The information didn't seem conclusive in any way. ,Whether people perceive those that are more 'like' them as more helpful or trustworthy.,,No,N/A,N/A
11,17,"manchester, uk","madrid, spain",na,whether non-native is more trustworthy/competent from their tone of voice,na,No,N/A,Trustworthiness + Accent
12,19,yorkshire,spain,tried to listen to which horse was best,prejudice based on accent,,No,N/A,Accent
13,22,England,Somewhere in Europe,"Based on the information that was given to me that I was able to understand, although it was very hard to do so since I would have preferred to have done it after hearing all of the information.",To determine how people react to native speakers vs non-native speakers,I had a hard time answering a majority of the questions since I don't see how I could reasonably make judgements on someone's intelligence or trustworthiness or any of the other factors surveyed based on two very short voice clips of them talking about horse racing. I wish there was an option for \I don't have an opinion on this\ because I didn't have an opinion for 90% of the questions asked of me. I said that they were intelligent and trustworthy based on the fact that they are supposed to be excellent horse tipsters which is the information I was given in this study.,No,Speakers said,N/A
14,23,"England, Northern maybe",Spain ,Description and photo of horse,Find out how choice is impacted by fluency of language,,Yes,Speakers said,N/A
15,24,Bolton,Italy,"I tried to understand which horse had the best chance of winning, however couldn't totally understand the non-native speaker first time so put some money on each horse just in case. I would've been more confident about betting large sums of money if I would have been able to hear her audio again.",To see if people have an unconscious bias towards native speakers of their first language,Fun study!,No,Speakers said,Accent
16,26,England,Romania,Based on the horse they said was the most consistent,To see if people are more likely to place higher bets based on the percieved competency of native speakers over non native speakers,,No,Speakers said,Accent
17,32,Yorkshire,Spain,Based on the experts' comments,Not sure,,No,Speakers said,N/A
18,33,UK,Spain,Just tried to listen for positive information in what the speakers were saying and gave more money if I heard more positive info,Assess how understanding of accents affects peoples perception of information,,No,Speakers said,Accent
19,39,England,Spain,Based on how confident the speaker sounded,,,No,Confidence,N/A
20,40,Scotland,Poland,Based on the information given by the speakers.,To better understand how accents/fluency affect people's perception of intelligence/knowledge.,,Yes,Speakers said,Accent
21,43,Manchester,Spain,Based on which horse sounded the most likely to win,To determine how people percieve different accents,,No,Speakers said,Accent
22,45,Yorkshire,France,Based on the information given about the horses' success in training and prior races,To examine prejudices towards non-native speakers of English,,No,Speakers said,Accent
23,46,yorkshire,south asia,Based on how they said the horses performed in previous races,"To see whether people perceive the validity of advice to be different between people with different accents, and also possibly between confident speech and \um\ing speech",,Yes,Speakers said,Accent
24,52,Midlands,Bangladesh,Tried to listen to the most trustworthy raitings as I have no idea about horse racing,To see if people are biased towards native English speakers in trusting thier opinions,,No,Speakers said,Trustworthiness + Accent
25,54,UK,South Asia?,"I wasn't really sure about the different qualifications of each horse as I don't know anything so they seemed fairly even to me, so I just did 25 for each.",To consider peoples opinions of native vs non-native English speakers?,I think maybe a topic that is more common would get more accurate assessments of peoples biases against accented English? Especially for younger people I don't know anyone who bets on horses - unless that's the point of the study ?,No,Uncertainty,Accent
26,56,no,Italy,what the horse looked like,To determine how people perceive others ,,No,Image,N/A
27,57,Birmingham,Spain,I tried to distribute them based on how confident the speakers sounded about them and how confident the trainers sounded about them.,To see if people judge information coming from native and non-native speakers differently. ,,No,Confidence,Accent
28,58,Scotland,Spain,"Based on description, but didn't want to bet too highly on first horse",,,No,Speakers said,N/A
29,59,Yorkshire,Eastern Europe - couldn't say a country,"I trusted the third speaker the most so I put the most on that horse, then distributed the remainder evenly between the other three.","How much people trust native vs non-native speakers of English, including native speakers with strong regional accents.",,No,Speakers said,Trustworthiness + Accent
30,62,Northern England,Spain,By listening to the successes of each horse,To determine if people find native or non native accents more trustworthy,,No,Speakers said,Trustworthiness + Accent
31,63,No,No,I just went for which horses sounded best,,,No,Speakers said,N/A
32,65,northern England,unsure,I tried to use the information given from the tipsters to decide how much to allot for each bet,T,,No,Speakers said,N/A
33,66,Sheffield,Spain,"I decided to give more money to the horses that seemed to have more objective good traits, not just the good opinions of the trainer, and to the ones the speakers seemed the most passionate or enthusiastic about.",To see if our biases around accents change how reliable or intelligent we perceive someone to be.,,No,Speakers said,Accent
34,67,Yorkshire,France,"Confidence in the descriptions, lack of fillers, as well as speed of the descriptions",,,No,Delivery,N/A
35,68,North England/Scotland,Potentially a west asian count,By the content of the messages and somewhat the name influenced it/,To see what the difference a native speaker vs non native speaker has on the influence of information,,No,Speakers said,Accent
36,69,England,No idea (terrible with accents),I just listened to the information given and judged whether the horse was likely to win,,,No,Speakers said,N/A
37,70,Northern England,France,Based on the information they provided,To see if people find native speaker more trustworthy ,,No,Speakers said,Trustworthiness + Accent
38,71,Englans,No,Based on the likelihood of success,to see whether native language spoken influences peoples behaviour and or trust,,No,Speakers said,Accent
39,73,United Kingdom,"Ethnicity-wise, India","How many positive things were said about the horse, and I was careful and lower in the beginning as I hadn't heard the rest. It was hard because I wasn't sure if I'd get to the end and the last ones would be the worst choices, when I'd already spent lower money on the better ones.","Possibly to figure out if people bet more on the horses that were introduced by the non-native speaker, finding prejudice or irritation.","I selected I would prefer to hear from the native speaker, only because it was easier to understand. I didn't feel any issue with the non-native speaker other than that, and that's personal to me, not a fault of theirs.",No,Speakers said,Accent
40,74,uk,france,"on how positive the speaker sounded, no hesitation",not sure ,,No,Speakers said,N/A
41,75,Yorkshire,Italy,If the speaker sounded like they knew what they were talking about,to see if we are more likely to bet if the speaker sounds like they know what they are talking about,,No,Speakers said,Confidence
42,79,Scotland,Poland,Simply based on how they made me feel,"If speaker's enthusiasm, percieved compentency, and accent affect participant confidence in what the speaker is saying. ",,No,Feelings,Accent
43,80,Spain,Leeds,based on how much i could understand and how much information was given about each of the horses past races and where they finished ,seeing whether people find foreign or non-foreign accents more reliable and prefferable,,No,Speakers said,Accent
44,82,Scotland,South Asia,I decided to keep the guaranteed £100 because betting isn't smart,Study biases against accented English,The native speaker was slow and 'ummed' a lot so she sounded less competent,No,N/A,Accent
45,84,asia,north england ,based off the descriptions of the horses and how they did ,to see if there is a bias between native and none native speakers when deciding value propositions ,,No,Speakers said,Accent
46,85,UK,Spain,I bet more on the ones that sounded better,see how people use their money when betting,,No,Speakers said,Betting behaviour
47,88,Scotland,Spain,Based on what the speakers were saying and how well versed they sounded.,Find out which voice people find more trustworthy,,No,Speakers said,Trustworthiness
48,89,northern england,india/pakistan ,names of horses,to see if people prefer native or non native accents,,No,Names,Accent
49,90,England,No,Went equal,Difference of advise between native and non native,,No,N/A,Accent
50,92,The Uk,India,based on how well i understoon the information spoken by the speaker,To examine how accents can alter our judgement of information,,No,Speakers said,Accent
51,93,North,Italy,How confident the bookies sounded plus the performance described of the horses,Do we find native speakers/familiar accents more trustworthy,,No,Speakers said,Trustworthiness + Accent
52,97,The north of England,Eastern Europe,Pure chance,To tell if someone trusts a native voice or a non-native voice more,,No,N/A,Trustworthiness + Accent
53,99,Manchester,Italy,Based on what the speaker said about the horses,to investigate what factors people consider when assessing how to place a bet,,No,Speakers said,Betting behaviour
54,100,"Was not paying attention to the accent, just the words that were being said",Maybe a Latinate country,"Based on the history of the horses, two were young and new to the races, one had just come back from a break but was doing really well and the other had a surprising good finish in the previous race.",To assess people's unconscious perception of accents.,When answering the question \which would you prefer to listen to\ there was no option for 'I don't mind' or 'both' which is what I would have liked to have put.,No,Speakers said,Accent
55,101,Manchester,Spain,on what was said about the horses,difference in native v non-native speakers in successfully delivering information,,No,Speakers said,Accent
56,102,England,Spain,Based on the info the people told me,To see if accents change opinions on information,,No,Speakers said,Accent
57,103,Scotland,Spain,tried to understand the points they were making,interpretation of different accents,,No,Speakers said,Accent
58,104,Scotland/North of England,Italy,Evenly,Look at perceptions of native English speakers to native and non-native English speakers,,No,N/A,Accent
59,106,English,African,"Just from the information gained, as well as wanting to spreading out the bets.",How trustworthy and receptive are we of non-native speakers compared to native speakers.,,No,Speakers said,Trustworthiness + Accent
60,108,England,Italy,on the horses previous performance,Attitudes towards people from different countries based on their accent,,No,Speakers said,Accent
61,111,the north of england,france,almost equally,to explore attitudes of british citizens towards non native english speakers,,No,N/A,Accent
62,114,no,no,based on the information provided about the horse and how it was doing,to see if having a non-native speaker affects how people view the trustworthiness of their information,,No,Speakers said,Trustworthiness + Accent
63,115,England,France,"None of them really sounded more promising than the other, so I bet them all equally",To decide how trustworthy or educated people with different accents are,,No,N/A,Trustworthiness + Accent
64,117,Yorkshire/North England,Somewhere in France,Mostly the content of what was said about the horses and how I expected they would perform,To gauge whether foreign/native accents can effect perception of honesty and trustworthiness when receiving information,The tone the recordings was quite improvisatory - like they were trying to come up with the information on the spot. Led me to think the information was slightly arbritrary rather than concrete. The shaking/slight stuttering slightly contributed to this.  ,No,Speakers said,Trustworthiness + Accent
65,119,Scotland,France,25% each,Ti see if your opinoun changed based on the speaker,"I thought it said you could leave some £ leftover so i did, but im not sure what leaving those £s did. Did they go to a non-selected horse?",No,N/A,Accent
66,120,Lancashire,Spain,the information provided by the speakers,,,No,Speakers said,N/A
67,122,UK,No idea - India? ,"I wanted the bets to be balanced across the four, but I tried to distribute according to the intel provided by the speakers",To assess the impact of a non-native accent on how trustworthy/expert someone is perceived.,,No,Speakers said,Trustworthiness + Accent
68,124,Northern England,Spain,Based on how reliable I thought they sounded,Unsure,,No,Reliabity,N/A
69,126,Not sure,Not sure,i bet conservatively because the information was very vague ,unsure,,No,Speakers said,N/A
70,128,England,Spain,On how confident and clear the speaker was and how talented the horse sounded,See how we perceive information from native or non native speakers,,No,Speakers said,Accent
71,129,South England,Eastern Europe,"I didn't really understand much of the horse racing lingo, so I just tried to decide based on how positive the experts sounded",Trustworthiness of advice based on accent,,No,Speakers said,Trustworthiness + Accent
72,132,England,France,By the information provided,To test if people process information differently dependent on accents ,,No,Speakers said,Accent
73,135,Romania ,Surrey,I listened to how well the horses run and how well the coaches thought their horse would run and bet accordingly. ,To see how people listen to and take advice from native and non-native speakers ,,No,Speakers said,Accent
74,136,England - Leeds?,Spain/India,even bets on all as non stood out from each other,to see if accent influences a persons decision,,No,Speakers said,Accent
75,137,Spain,Manchester,Based it off the more descriptive info about the horses,Not sure,,No,Speakers said,N/A
76,138,Scotland,France,"I went primarily on how how confident the speaker sounded, and then the tips they were going secondary to that ",,,No,Delivery,N/A
77,139,France?,France?,The history and success of the horses,To see if accents/language can impact financial decisions e.g. betting?,,No,Speakers said,Accent
78,140,United Kingdom,Japan,Based on the descriptions of the horse's success,,,No,Speakers said,N/A
79,141,No,No,Based on what they said,I don't know ,,No,Speakers said,N/A
80,143,northern england,france or spain,Distrubuted my bets in accordance with the information provided. None of the speakers seemed particularly enthused about a winner and sounded like they were reading from a clipping from a bet slip on the horse.,To see if bias in accent influences trustworthiness in regards to spending money or seeking advice,,No,Speakers said,Trustworthiness + Accent
81,145,UK,France,Just random,How youd place bets based on whether someone has a  native or non native accent,I couldn't change bets made on the horses after i had done them which was a shame,No,N/A,Accent
82,146,Yorkshire,Spain,Based on the prior achievements of the horses.,To see the impact that non-native vs native speaker has on the ability to influence people.,,No,Speakers said,Accent
83,147,Spain,Manchester,Based on that I didn't know what would be said about the next horse,To understand people's perception of accents,,No,N/A,Accent
84,148,England?,Somewhere in Eastern Europe? ,Evenly ,To see if native speaker influences bias in betting?,,No,N/A,Accent
85,149,Yorkshire,France,How best i understood them,To see if how something is presented effects the chance of choosing something,,No,Speakers said,Betting behaviour
86,150,Scotland,Spain,Previous results of horses,,,No,Speakers said,N/A
87,152,Southern Scotland,My gut tells me it was someone from England doing an exotic accent,Based on the image of the horse and informed by the statistics given.,To check how accents inform our perceptions of others.,,No,Speakers said,Accent
88,153,england,argentina,How enthusiastic the language was,to see if you voted differently depending on the familiarity of the accent,,No,Delivery,Accent
89,154,sussex,spain,I was impressed with the first horse and felt he was the most promising ,to see if you favour the horse based on the speaker,,No,Speakers said,Accent
90,155,Yorkshire,Spain,Based on what they said about the horses,Judging people's accents,,No,Speakers said,Accent
91,156,England,France,Based on how confident the speaker sounded giving the information,To determine if those native English speakers will trust a native speaker more,,No,Delivery,Trustworthiness + Accent
92,157,Eastern europe,Scotland,The horses in which the speakers had more \umms\ and \ahhs\ sounded less convincing,To see the correlation between different accents and how they affect our decision making,,No,Delivery,Accent
93,159,Scotland,Poland,On what the speakers were describing in terms of how prepared the horses and riders were.,To investigate whether native speakers are perceived differently (maybe more trustworthy etc.) compared to non-native speakers.,,No,Speakers said,Trustworthiness + Accent
94,162,england,France,from how good the horses were decribed ,if we trust non native information,,No,Speakers said,Trustworthiness + Accent
95,164,England,France,Randomly,To determine how people utilise betting advice based on who its from,,No,N/A,Accent
96,166,The UK,France,"Mostly quite even, except for Apocalypse because I liked the name and the description mentioned about the terrain",To identify whether native vs non-native impact people's trust in experts and whether accent plays a part,,No,N/A,Trustworthiness + Accent
97,168,UK,Europe,based on prior success of the horses,whether people trust information from native speakers more than from non-native speakers,,No,Speakers said,Trustworthiness + Accent
98,169,North England,Spain,From descriptions and appearances.,,,No,Speakers said,N/A
99,171,England,France,By how successful they described the horse,To see how people view native / non native speakers,,No,Speakers said,Accent
100,173,spain,northern england,previous results,find out about preconceptions of native vs non native speakers,,No,Speakers said,Accent
101,174,London,France,based on information given and name of horse,How reliable/intelligent we think someone is based on accent,,No,Speakers said,Accent
102,175,Scotland,France,Based on what the experts said,,,No,Speakers said,N/A
103,177,Silver Sky,The other three horses,Based on how well the horse performed in the past,How well the speakers words come across to make better informed decisions on the horses. ,,No,Speakers said,Clarity
104,178,Englad,Sweden,I based it off the horses recent performance,To study how different accents affect how much we trust information given to us,,No,Speakers said,Trustworthiness + Accent
105,183,No,No,Based on the facts,I am unsure,NA,No,Speakers said,N/A
106,186,North West,no,what they said about performance,something about trusting native vs non natives when given information,,No,Speakers said,Trustworthiness + Accent
107,188,Italy,Manchester,"Trying to find key words, like win, excellent, improved ",The trustworthiness of tipster,,No,Speakers said,Trustworthiness
108,190,UK - Northern,Unsure,Based on their information,How people view non native speakers ,,No,Speakers said,Accent
109,191,Scotland,Spain,Based on the horses' past performances,Do people trust native or non-native speakers more?,,No,Speakers said,Trustworthiness + Accent
110,192,No,No,How promising the horses seemed,Whether people with english as a first language trust native speakers more than non-native,,No,Speakers said,Trustworthiness + Accent
111,193,England,France,Based on the testimony of the speakers and their confidence in each horses' ability,,,No,Speakers said,N/A
112,194,France,England,"I couldn't understand a lot of the horse jargon so I picked out whether they said the horse had won a race, been runner up, in third place etc. Gave the most money (£60) to the horse who previously came in first place and £40 to the one who had been runner up. Nothing to the others.",To see if you spend less money based on the advice of the non-native speaker,,No,Speakers said,Accent
113,195,No,France?,Even spread,To see whether people are more or less likely to trust native or non-native speakers and whether confidence of delivery affects this.,,No,N/A,Trustworthiness + Accent
114,196,Yorkshire,Spain or Italy,Bit of guess work more than listening to what the commentators were saying. Was hard to concentrate on what they said cause it was like they were bad at reading.,Comparing native and non-native accents,,No,Speakers said,N/A
115,198,england,france,based on information,impact of accent on decision making,,No,Speakers said,Accent
116,200,North of England,France,Based on the confidence of the speaker voice,to investigate the impact of accents on perception,,No,Confidence,Accent
117,201,United Kingdom,South America ,Based on the information provided by the speakers and how I inerpreted it.,To see people's perception of accented speech vs. non-accented speech.,,No,Speakers said,Accent
118,202,no,no,equally because i dont know anything about horses,differing bet values based on the accent ,,No,N/A,Accent
119,205,london,turkey,based on the information given,to understand how people feel towards different accents,,No,Speakers said,Accent
120,207,North England,France,Description of the horses and how enthusiastic the speaker sounded,To tell if people are more likely to listen to a native speaker or non-native speaker,,No,Speakers said,Accent
121,208,glasgow,poland,mostly guess work,how you interpret voices,,No,Speakers said,N/A
122,211,England,Indonesia,"Didn't feel confident in the first 3 horses, but felt like playing anyway so just put some money on the last horse.",,,No,N/A,N/A
123,213,scotland,india,based on the length/description of the speaker,the difference between native and non native speakers,,No,Speakers said,Accent
124,218,North somewhere ,No,"Not a lot of strategy, just going for it, none stuck out more than others ",Unsure ,,No,N/A,N/A
125,221,United Kingdom,Latvia,Mostly Evenly ,Finding if voices affect peoples perspective.,,No,N/A,Accent
126,223,Scotland,India?,"The only useful information I got was regarding the 4th horse, Apocalypse. Apparently he did very well elsewhere, so based on that I gave him the majority bet. The second horse had basically no information besides \he did better than we thought he would\, which didn't inspire confidence.",Something about accent bias in the way we take in information; we may be more inclined to believe people who sound like us.,No thank you,No,Speakers said,Accent
127,225,Yorkshire,France,I imagined how I would approach it if it were me and when I discoverd that I didn't have to bet it all I decided I would prefer to keep the entire £100 and not bet.,To find biases against accents,,No,N/A,Accent
